index,news,strength
2379,December was a record volume month for Ethereum options,0
2380,Bitcoin mining difficulty adjusts to a new record high above 20 trillion,0
2381,Bill Miller cites bitcoin as a risk management strategy in the current climate,0
2382,December saw the highest monthly volume for Ethereum futures to date,0
2383,Coinbase acquires crypto trade execution startup Routefire,0
2384,UKs finance ministry opens consultation on regulating crypto and stablecoins,0
2385,"Stacks 2.0 Mainnet Launch on January 14, 2021",0
2386,Ripple CEO Brad Garlinghouse responds to questions surrounding the SEC lawsuit,0
2387,Coinbase hits number 30 in the top 100 free apps on Apples mobile store,0
2388,"Bitcoin shoots past $40,000 for the first time ever",0
2389,ETHs market capitalization hits a new all-time high,0
2390,"PayPal, Coinbase among firms to invest in crypto tax automation startup TaxBit",0
2391,"Finlands customs authority is looking to sell bitcoin seized in 2016, now worth more than $75 million",0
2392,South Korean gaming giant Nexon is preparing to acquire crypto exchange Bithumb for about $460 million: Report,0
2393,Trading desks are staffing up in anticipation of a prolonged bitcoin bull run,0
2394,Global cryptocurrency market cap hits $1 trillion,0
2395,"Bill Miller invokes Warren Buffetts rat poison criticism of Bitcoin, says the rat could be cash",0
2396,Kraken says its customers have staked more than $1 billion in crypto via its service,0
2397,Trust within the gambling industry is vital to the growth of cryptocurrencies,0
2398,Will Bitcoin Hit Record Highs in 2021?,0
2402,OKEx introduces one of cryptos largest loyalty rewards programs,0
2403,Stable +30% BTCs monthly with FBC13  - Interview with FBC fund CEO,0
2407,"Celsius and Horizen to Build Fully Decentralized, Privacy-Preserving Blockchain",0
2437,"+1095% BTC per year with RJV12, scam or revolution in trading?",0
2438,Gambling for a good cause  CryptoSlots donates all proceeds from new slot to the fight against coronavirus,0
2439,"Litecoin, The Chinese Alternative to Bitcoin",0
